"Customer Company Name - required","Industry Vertical - required","Industry Other - required if Industry Vertical = Other","Does opportunity belong to NatSec? - required if Industry Vertical = Government  Specify whether this opportunity contains classified National Security information.","Country - required","State/Province - required if Country = United States","Postal Code - required","Website - required","Partner Primary Need from AWS - required","Partner Project Title - required","Customer Business Problem - required","Solution Offered - required","Other Solution Offered - required if Solution Offered = Other","Next Steps - applicable if Partner Primary Need from AWS = Co-Sell","Use Case - required","Estimated AWS Monthly Recurring Revenue - required","Target Close Date(mm/dd/yyyy) - required","Opportunity Type - required","Delivery Model - required","Is Opportunity from Marketing Activity? - required  Indicate whether this opportunity was sourced from a marketing activity.","Was Marketing Development Funds Used? - required if Is Opportunity from Marketing Activity? = Yes  Indicate whether marketing development funds (MDF) were used for this opportunity.","Customer DUNS","Sales Activities - required if Partner Primary Need from AWS = Co-Sell","AWS Products","Parent Opportunity ID (applicable only if Opportunity Type = Flat Renewal or Expansion)","Customer First Name","Customer Last Name","Customer Title","Customer Phone","Customer Email","AWS Account ID","Additional Comments","Street Address","City","Competitive Tracking","Other Competitors - required if Competitive Tracking = *Other","Marketing Campaign (applicable only if Is Opportunity from Marketing Activity? = Yes)","Marketing Activity Channel (applicable only if Is Opportunity from Marketing Activity? = Yes)","Marketing Activity Use-Case (applicable only if Is Opportunity from Marketing Activity? = Yes)","APN Programs","Primary Sales Contact First Name","Primary Sales Contact Last Name","Primary Sales Contact Phone","Primary Sales Contact Email","Primary Contact Title","Partner CRM Unique Identifier","Is Opportunity from Marketing Activity? - required"
"Accolade","Software & Internet",NA,NA,"United States","Arizona","86313","https://www.accolade.com","Co-Sell - Deal Support","Accolade - Ping","Wanted to transact this opportunity Marketplace","Helped them to transact Marketplace",NA,"Please accept this opportunity","Security & Compliance",86220.7061111111,2024-12-31,"Net New Business","SaaS or PaaS",NA,NA,NA,"Agreed on solution to Business Problem",NA,NA,NA,NA,NA,NA,NA,"063473290800",NA,NA,NA,NA,NA,NA,NA,NA,NA,NA,NA,NA,NA,NA,NA,"No"
"Ridgeline Inc","Software & Internet",NA,NA,"United States","Arizona","85005","https://www.ridgeline.com","Co-Sell - Deal Support","Ridgeline Inc - Crowdstrike Renewal - Renewal","Wanted to transact this opportunity Marketplace","Helped them to transact Marketplace",NA,"Please accept this opportunity","Security & Compliance",5102.16,2024-12-31,"Flat Renewal","SaaS or PaaS",NA,NA,NA,"Agreed on solution to Business Problem",NA,"offer-zedfdag566hxm",NA,NA,NA,NA,NA,"582453453786",NA,NA,NA,NA,NA,NA,NA,NA,NA,NA,NA,NA,NA,NA,NA,"No"
"Knox Community Hospital","Software & Internet",NA,NA,"United States","Michigan","48187","https://www.hospital.com","Co-Sell - Deal Support","Knox Community Hospital - Trend Micro","Wanted to transact this opportunity Marketplace","Helped them to transact Marketplace",NA,"Please accept this opportunity","Security & Compliance",4126.66666666667,2024-12-31,"Net New Business","SaaS or PaaS",NA,NA,NA,"Agreed on solution to Business Problem",NA,NA,NA,NA,NA,NA,NA,"304527618541",NA,NA,NA,NA,NA,NA,NA,NA,NA,NA,NA,NA,NA,NA,NA,"No"
"First Team Real Estate","Software & Internet",NA,NA,"United States","Michigan","48127","https://www.estate.com","Co-Sell - Deal Support","First Team Real Estate - Trend Micro","Wanted to transact this opportunity Marketplace","Helped them to transact Marketplace",NA,"Please accept this opportunity","Security & Compliance",4156.11416666667,2024-12-31,"Net New Business","SaaS or PaaS",NA,NA,NA,"Agreed on solution to Business Problem",NA,NA,NA,NA,NA,NA,NA,"561471109479",NA,NA,NA,NA,NA,NA,NA,NA,NA,NA,NA,NA,NA,NA,NA,"No"
